[
  {
    "destination_id": "round2_east_001",
    "destination_name": "Gahirmatha Marine Sanctuary",
    "district": "Kendrapara",
    "nearest_police_station_id": "police_talchua_coastal_ps",
    "nearest_police_station_name": "Talchua Coastal Marine Police Station",
    "nearest_hospital_id": "hosp_rajnagar_chc",
    "nearest_hospital_name": "Community Health Centre Rajnagar",
    "emergency_contacts": [
      {
        "label": "All-in-One Emergency",
        "number": "112",
        "service_type": "all_emergency",
        "is_24x7": true
      },
      {
        "label": "Ambulance Service",
        "number": "108",
        "service_type": "ambulance",
        "is_24x7": true
      },
      {
        "label": "Rajnagar Forest Division (Wildlife)",
        "number": "06729-272464",
        "service_type": "forest_department",
        "is_24x7": true
      },
      {
        "label": "Coastal Police Emergency",
        "number": "06729-273233",
        "service_type": "coastal_security",
        "is_24x7": true
      }
    ],
    "safety_advisories": [
      {
        "category": "wildlife_caution",
        "title": "Turtle Nesting Conservation Zone",
        "guidance": "Mechanized fishing vessels and night illumination are strictly regulated from Nov to May to safeguard mass Olive Ridley turtle Arribada nesting.",
        "severity": "warning"
      },
      {
        "category": "water_safety",
        "title": "Tidal Estuary Navigation",
        "guidance": "High tidal currents occur near river mouths (Dhamra/Mahanadi). Life jackets are mandatory on all authorized forest department patrol boats.",
        "severity": "caution"
      }
    ],
    "network_connectivity": "patchy_rural",
    "best_visiting_hours": "07:00 - 16:30 (Daytime boat permits only)",
    "source": "Odisha Forest Dept (Rajnagar Mangrove Wildlife Division) & Coastal Security",
    "source_url": "https://forest.odisha.gov.in/",
    "last_verified": "2026-08-31"
  },
  {
    "destination_id": "round2_east_002",
    "destination_name": "Hukitola Monument",
    "district": "Kendrapara",
    "nearest_police_station_id": "police_jamboo_marine_ps",
    "nearest_police_station_name": "Jamboo Marine Police Station",
    "nearest_hospital_id": "hosp_rajnagar_chc",
    "nearest_hospital_name": "Community Health Centre Rajnagar",
    "emergency_contacts": [
      {
        "label": "All-in-One Emergency",
        "number": "112",
        "service_type": "all_emergency",
        "is_24x7": true
      },
      {
        "label": "Ambulance",
        "number": "108",
        "service_type": "ambulance",
        "is_24x7": true
      },
      {
        "label": "Jamboo Marine Police",
        "number": "06729-276233",
        "service_type": "police",
        "is_24x7": true
      },
      {
        "label": "Kendrapara District Control Room",
        "number": "06727-232803",
        "service_type": "disaster_control",
        "is_24x7": true
      }
    ],
    "safety_advisories": [
      {
        "category": "water_safety",
        "title": "Island Access via Tidal Waterways",
        "guidance": "Access is strictly by registered motor launch from Gupti/Jamboo ghats. Trips must align with daylight high-tide schedules.",
        "severity": "caution"
      },
      {
        "category": "monument_protection",
        "title": "Historic Heritage Precautions",
        "guidance": "Carry sufficient drinking water as the island is uninhabited; follow designated stone walkways inside the 1867 colonial storehouse.",
        "severity": "info"
      }
    ],
    "network_connectivity": "low_remote",
    "best_visiting_hours": "08:00 - 15:30 (Depart island before dusk)",
    "source": "District Administration Kendrapara & Tourism Dept",
    "source_url": "https://kendrapara.nic.in/tourist-place/hukitola-island/",
    "last_verified": "2026-08-31"
  },
  {
    "destination_id": "round2_east_003",
    "destination_name": "Kanika Palace",
    "district": "Kendrapara",
    "nearest_police_station_id": "police_rajnagar_ps",
    "nearest_police_station_name": "Rajnagar Police Station",
    "nearest_hospital_id": "hosp_rajkanika_chc",
    "nearest_hospital_name": "Community Health Centre Rajkanika",
    "emergency_contacts": [
      {
        "label": "Emergency Helpline",
        "number": "112",
        "service_type": "all_emergency",
        "is_24x7": true
      },
      {
        "label": "Ambulance",
        "number": "108",
        "service_type": "ambulance",
        "is_24x7": true
      },
      {
        "label": "Rajkanika CHC",
        "number": "06729-278225",
        "service_type": "ambulance",
        "is_24x7": true
      }
    ],
    "safety_advisories": [
      {
        "category": "monument_protection",
        "title": "Heritage Museum Etiquette",
        "guidance": "Private photography may be restricted inside the royal heirloom museum gallery; follow palace estate rules.",
        "severity": "info"
      }
    ],
    "network_connectivity": "good_4g_5g",
    "best_visiting_hours": "09:00 - 17:00",
    "source": "Kendrapara District Tourism & Rajkanika Administration",
    "source_url": "https://kendrapara.nic.in/",
    "last_verified": "2026-08-31"
  },
  {
    "destination_id": "round2_east_004",
    "destination_name": "Aul Palace",
    "district": "Kendrapara",
    "nearest_police_station_id": "police_rajnagar_ps",
    "nearest_police_station_name": "Rajnagar Police Station",
    "nearest_hospital_id": "hosp_aul_chc",
    "nearest_hospital_name": "Community Health Centre Aul",
    "emergency_contacts": [
      {
        "label": "Emergency Helpline",
        "number": "112",
        "service_type": "all_emergency",
        "is_24x7": true
      },
      {
        "label": "Ambulance",
        "number": "108",
        "service_type": "ambulance",
        "is_24x7": true
      },
      {
        "label": "Aul CHC Hospital",
        "number": "06729-275220",
        "service_type": "ambulance",
        "is_24x7": true
      }
    ],
    "safety_advisories": [
      {
        "category": "water_safety",
        "title": "Kharasrota River Embankment Caution",
        "guidance": "Maintain safe distance from unfenced riverbanks during monsoon spate.",
        "severity": "caution"
      }
    ],
    "network_connectivity": "good_4g_5g",
    "best_visiting_hours": "09:00 - 17:30",
    "source": "District Administration Kendrapara",
    "source_url": "https://kendrapara.nic.in/",
    "last_verified": "2026-08-31"
  },
  {
    "destination_id": "round2_east_005",
    "destination_name": "Rakta Tirtha Eram",
    "district": "Bhadrak",
    "nearest_police_station_id": "police_basudevpur_ps",
    "nearest_police_station_name": "Basudevpur Police Station",
    "nearest_hospital_id": "hosp_basudevpur_chc",
    "nearest_hospital_name": "Community Health Centre Basudevpur",
    "emergency_contacts": [
      {
        "label": "Emergency Helpline",
        "number": "112",
        "service_type": "all_emergency",
        "is_24x7": true
      },
      {
        "label": "Ambulance",
        "number": "108",
        "service_type": "ambulance",
        "is_24x7": true
      },
      {
        "label": "Basudevpur Police Station",
        "number": "06784-271233",
        "service_type": "police",
        "is_24x7": true
      }
    ],
    "safety_advisories": [
      {
        "category": "monument_protection",
        "title": "Martyr Memorial Sanctity",
        "guidance": "Respect memorial grounds and saheed smrutistambha cenotaphs.",
        "severity": "info"
      }
    ],
    "network_connectivity": "good_4g_5g",
    "best_visiting_hours": "08:00 - 18:00",
    "source": "District Administration Bhadrak",
    "source_url": "https://bhadrak.nic.in/",
    "last_verified": "2026-08-31"
  },
  {
    "destination_id": "round2_east_006",
    "destination_name": "Biranchinarayan Sun Temple, Palia",
    "district": "Bhadrak",
    "nearest_police_station_id": "police_bhadrak_town_ps",
    "nearest_police_station_name": "Bhadrak Town Police Station",
    "nearest_hospital_id": "hosp_bhadrak_dhh",
    "nearest_hospital_name": "District Headquarters Hospital Bhadrak",
    "emergency_contacts": [
      {
        "label": "Emergency",
        "number": "112",
        "service_type": "all_emergency",
        "is_24x7": true
      },
      {
        "label": "Ambulance",
        "number": "108",
        "service_type": "ambulance",
        "is_24x7": true
      }
    ],
    "safety_advisories": [
      {
        "category": "temple_etiquette",
        "title": "Ancient Wooden Craft Protection",
        "guidance": "Do not touch or lean on 13th-century carved wooden ceilings and Surya sculptures.",
        "severity": "info"
      }
    ],
    "network_connectivity": "good_4g_5g",
    "best_visiting_hours": "06:00 - 18:00",
    "source": "Archaeological Survey / Bhadrak NIC",
    "source_url": "https://bhadrak.nic.in/",
    "last_verified": "2026-08-31"
  },
  {
    "destination_id": "round2_east_007",
    "destination_name": "Maa Bhadrakali Temple",
    "district": "Bhadrak",
    "nearest_police_station_id": "police_bhadrak_town_ps",
    "nearest_police_station_name": "Bhadrak Town Police Station",
    "nearest_hospital_id": "hosp_bhadrak_dhh",
    "nearest_hospital_name": "District Headquarters Hospital Bhadrak",
    "emergency_contacts": [
      {
        "label": "All Emergency",
        "number": "112",
        "service_type": "all_emergency",
        "is_24x7": true
      },
      {
        "label": "Ambulance",
        "number": "108",
        "service_type": "ambulance",
        "is_24x7": true
      },
      {
        "label": "Bhadrak DHH Hospital",
        "number": "06784-251224",
        "service_type": "ambulance",
        "is_24x7": true
      }
    ],
    "safety_advisories": [
      {
        "category": "temple_etiquette",
        "title": "Festival Crowd Management",